{
  "semantic_score": 95.0,
  "overall_assessment": "Extremely high fidelity between Figma design and rendered HTML output with only minimal, nearly imperceptible differences",
  "feedback": [
    {
      "category": "colors",
      "issue": "Slight variation in pink cardigan color intensity",
      "measurement": "Marginal saturation difference",
      "fix": "Fine-tune color hex code to match Figma exact shade",
      "priority": "low"
    }
  ],
  "strengths": [
    "Precise layout matching",
    "Accurate color palette representation",
    "Consistent typography",
    "Faithful product image rendering",
    "Exact button and dropdown styling",
    "Responsive grid and component positioning"
  ],
  "raw_response": "After carefully comparing the two images, here's my detailed analysis:\n\n```json\n{\n  \"semantic_score\": 95.0,\n  \"overall_assessment\": \"Extremely high fidelity between Figma design and rendered HTML output with only minimal, nearly imperceptible differences\",\n  \"feedback\": [\n    {\n      \"category\": \"colors\",\n      \"issue\": \"Slight variation in pink cardigan color intensity\",\n      \"measurement\": \"Marginal saturation difference\",\n      \"fix\": \"Fine-tune color hex code to match Figma exact shade\",\n      \"priority\": \"low\"\n    }\n  ],\n  \"strengths\": [\n    \"Precise layout matching\",\n    \"Accurate color palette representation\", \n    \"Consistent typography\",\n    \"Faithful product image rendering\",\n    \"Exact button and dropdown styling\",\n    \"Responsive grid and component positioning\"\n  ]\n}\n```\n\nThe rendered HTML output is remarkably faithful to the original Figma design. The product images, color swatches, typography, button styling, and overall layout are virtually identical. The short-sleeve cashmere cardigan is displayed with exceptional visual consistency across both versions.\n\nWould you like me to elaborate on any specific aspect of the visual comparison?"
}